### ISSUE TITLE
TCP teardown errors with high stream counts (128+)

### ISSUE THREAD

**Issue by lance0** [lance0/xfr#32]
## Description

With high parallel stream counts (`-P 128`), teardown errors still occur despite the fixes in #25. The original fix works for normal stream counts (confirmed by @matttbe with 50 iterations of 1-second runs), but 128 streams triggers two distinct problems.

Reported by @matttbe in https://github.com/lance0/xfr/issues/25#issuecomment-4005897380

## Reproduction

```bash
xfr <host> -P 128 --no-tui
```

Tested in a network namespace with veth pairs at ~19 Mbps.

## Problem 1: Post-test RST cascade

When the server's duration timer fires, it cancels all receive handlers, which drop their `TcpStream`. Dropping a socket with unread data in the kernel buffer sends RST (not FIN) to the client. The client's send tasks are still running — the client doesn't learn the test is over until the `Result` message arrives on the control channel, which happens *after* the server has already torn down all data streams.

The client's error suppression checks `cancel` (not yet set), `deadline_reached` (not yet, due to timing asymmetry), and `near_deadline` (250ms grace, not enough). So the errors are treated as fatal and logged as `ERROR`.

**Timing asymmetry**: The server starts its interval timer before any data streams connect. Each client `send_data` starts its own deadline from when that stream connects. With 128 sequential TCP connects, late-starting streams have deadlines that lag the server's by hundreds of milliseconds.

**Join timeout**: The 2s hardcoded timeout for `join_all` on stream handles isn't enough for 128 tasks.

## Problem 2: Mid-test broken pipe

In one trace, stream 16 gets `Broken pipe` at ~7s into a 10s test while the test continues running (intervals 8 and 9 still arrive). This is well before either side's deadline. Cause is unclear — possibly kernel-level resource pressure with 128 TCP connections competing for ~19 Mbps (~150 kbps per stream).

## Planned fixes

- [x] Scale the client join timeout with stream count (`max(2s, streams * 50ms)`) — v0.9.1
- [x] Client stops local data streams at local duration expiry (narrows server/client teardown race) — v0.9.1
- [x] Receive-side cancel drain to reduce RST-on-close bursts — v0.9.1
- ~Server gracefully shuts down data sockets (FIN instead of RST)~ — RST is correct for timed tests; FIN would let bufferbloated send buffers drain past the requested duration
- [ ] Investigate mid-test stream failures under high contention

## Related

- #25 — original teardown fix (works for normal stream counts)
- #24 — JoinHandle panic fix

**Comment by matttbe** [comment]
> We can't fully replicate network namespace + veth pair conditions here though, so [@matttbe](https://github.com/matttbe) a retest with your setup would be great when you get a chance.

Sure. I'm still using the same `test.sh` file that I sent in #24.

It looks better with the v0.9.1 indeed, no more issues at the end.

Still some in the middle. With a longer transfer, it is easier to reproduce it:

```
# ip netns exec "${NS}_cli" ./target/release/xfr 10.0.0.1 -P 128 --no-tui -t 30s
 INFO Connecting to 10.0.0.1:5201...
 INFO Connected to 10.0.0.1:5201
 INFO Client connected: [::ffff:10.0.10.2]:41248
 INFO Test requested: TCP 128 streams, Upload mode, 30s
[0.164]  0.0 Mbps  0 B  rtx: 3  rtt: 22.64ms
[1.065]  17.2 Mbps  2.05 MB  rtx: 806  rtt: 50.60ms
[2.065]  19.2 Mbps  2.29 MB  rtx: 1241  rtt: 63.85ms
[3.065]  19.3 Mbps  2.31 MB  rtx: 1528  rtt: 66.85ms
[4.066]  19.4 Mbps  2.31 MB  rtx: 1847  rtt: 65.58ms
[5.065]  18.8 Mbps  2.23 MB  rtx: 2146  rtt: 66.99ms
[6.065]  19.4 Mbps  2.32 MB  rtx: 2389  rtt: 67.87ms
[7.065]  18.9 Mbps  2.25 MB  rtx: 2692  rtt: 67.38ms
[8.066]  19.1 Mbps  2.28 MB  rtx: 3023  rtt: 66.81ms
[9.066]  19.2 Mbps  2.30 MB  rtx: 3288  rtt: 70.84ms
[10.066]  19.0 Mbps  2.27 MB  rtx: 3543  rtt: 71.45ms
[11.065]  19.3 Mbps  2.30 MB  rtx: 3848  rtt: 69.08ms
 WARN Unexpected peer-close on stream 106 after 9.466s (cancel=false, deadline_reached=false, near_deadline=false): Broken pipe (os error 32)
ERROR Send error on stream 106: Broken pipe (os error 32)
ERROR Send error: Broken pipe (os error 32)
[12.065]  19.1 Mbps  2.27 MB  rtx: 4165  rtt: 65.88ms
[13.066]  19.2 Mbps  2.28 MB  rtx: 4428  rtt: 70.36ms
[14.065]  19.0 Mbps  2.27 MB  rtx: 4687  rtt: 71.18ms
[15.066]  19.3 Mbps  2.30 MB  rtx: 4958  rtt: 70.46ms
 WARN Unexpected peer-close on stream 11 after 15.194s (cancel=false, deadline_reached=false, near_deadline=false): Broken pipe (os error 32)
ERROR Send error on stream 11: Broken pipe (os error 32)
ERROR Send error: Broken pipe (os error 32)
 WARN Unexpected peer-close on stream 13 after 15.194s (cancel=false, deadline_reached=false, near_deadline=false): Broken pipe (os error 32)
ERROR Send error on stream 13: Broken pipe (os error 32)
ERROR Send error: Broken pipe (os error 32)
[16.066]  19.0 Mbps  2.27 MB  rtx: 5231  rtt: 68.66ms
[17.066]  19.1 Mbps  2.28 MB  rtx: 5489  rtt: 72.12ms
[18.066]  19.1 Mbps  2.27 MB  rtx: 5745  rtt: 73.02ms
[19.066]  19.3 Mbps  2.30 MB  rtx: 6033  rtt: 69.50ms
[20.066]  19.2 Mbps  2.29 MB  rtx: 6322  rtt: 68.30ms
 WARN Unexpected peer-close on stream 123 after 9.549s (cancel=false, deadline_reached=false, near_deadline=false): Broken pipe (os error 32)
ERROR Send error on stream 123: Broken pipe (os error 32)
ERROR Send error: Broken pipe (os error 32)
 WARN Unexpected peer-close on stream 112 after 18.695s (cancel=false, deadline_reached=false, near_deadline=false): Broken pipe (os error 32)
ERROR Send error on stream 112: Broken pipe (os error 32)
ERROR Send error: Broken pipe (os error 32)
[21.066]  19.0 Mbps  2.26 MB  rtx: 6565  rtt: 72.09ms
[22.066]  19.2 Mbps  2.28 MB  rtx: 6822  rtt: 70.38ms
[23.065]  19.2 Mbps  2.29 MB  rtx: 7104  rtt: 70.86ms
[24.065]  19.0 Mbps  2.27 MB  rtx: 7426  rtt: 69.96ms
[25.065]  19.0 Mbps  2.26 MB  rtx: 7713  rtt: 70.10ms
[26.065]  19.5 Mbps  2.32 MB  rtx: 8003  rtt: 70.34ms
[27.065]  18.9 Mbps  2.26 MB  rtx: 8298  rtt: 68.91ms
[28.066]  19.2 Mbps  2.29 MB  rtx: 8547  rtt: 72.11ms
[29.066]  19.0 Mbps  2.26 MB  rtx: 8826  rtt: 72.67ms
 WARN Test cancelled during stream collection
 INFO Test 950cbf50-cc3c-4e77-87f9-cd4179c63c26 complete: 18.94 Mbps, 71525408 bytes
 WARN Timed out waiting 6.4s for 128 data streams to stop; aborting remaining tasks
────────────────────────────────────────────────────────────
  xfr Test Results
────────────────────────────────────────────────────────────

  Duration:    30.20s
  Transfer:    68.21 MB
  Throughput:  18.9 Mbps

  Sender TCP Info:
    Retransmits: 9221
    RTT:         69.02ms
    RTT Var:     7.04ms
    Cwnd:        0 KB

  Per-Stream Results:
    [0] 1.10 MB @ 0.3 Mbps  rtx: 134
    [1] 0 B @ 0.0 Mbps  rtx: 7
    [2] 0 B @ 0.0 Mbps  rtx: 7
    [3] 827.23 KB @ 0.2 Mbps  rtx: 129
    [4] 545.83 KB @ 0.1 Mbps  rtx: 118
    [5] 813.09 KB @ 0.2 Mbps  rtx: 87
    [6] 835.71 KB @ 0.2 Mbps  rtx: 123
    [7] 0 B @ 0.0 Mbps  rtx: 7
    [8] 762.18 KB @ 0.2 Mbps  rtx: 111
    [9] 359.17 KB @ 0.1 Mbps  rtx: 107
    [10] 0 B @ 0.0 Mbps  rtx: 8
    [11] 0 B @ 0.0 Mbps  rtx: 0
    [12] 388.87 KB @ 0.1 Mbps  rtx: 85
    [13] 0 B @ 0.0 Mbps  rtx: 0
    [14] 641.98 KB @ 0.2 Mbps  rtx: 101
    [15] 1.06 MB @ 0.3 Mbps  rtx: 134
    [16] 644.81 KB @ 0.2 Mbps  rtx: 115
    [17] 1.14 MB @ 0.3 Mbps  rtx: 130
    [18] 899.34 KB @ 0.2 Mbps  rtx: 121
    [19] 1023.78 KB @ 0.3 Mbps  rtx: 124
    [20] 1.02 MB @ 0.3 Mbps  rtx: 131
    [21] 1.41 KB @ 0.0 Mbps  rtx: 8
    [22] 886.62 KB @ 0.2 Mbps  rtx: 130
    [23] 487.85 KB @ 0.1 Mbps  rtx: 82
    [24] 0 B @ 0.0 Mbps  rtx: 7
    [25] 896.52 KB @ 0.2 Mbps  rtx: 122
    [26] 0 B @ 0.0 Mbps  rtx: 7
    [27] 721.17 KB @ 0.2 Mbps  rtx: 96
    [28] 858.34 KB @ 0.2 Mbps  rtx: 136
    [29] 1.11 MB @ 0.3 Mbps  rtx: 114
    [30] 0 B @ 0.0 Mbps  rtx: 7
    [31] 1.17 MB @ 0.3 Mbps  rtx: 109
    [32] 1.12 MB @ 0.3 Mbps  rtx: 132
    [33] 871.06 KB @ 0.2 Mbps  rtx: 117
    [34] 909.24 KB @ 0.2 Mbps  rtx: 130
    [35] 958.73 KB @ 0.3 Mbps  rtx: 110
    [36] 0 B @ 0.0 Mbps  rtx: 7
    [37] 808.84 KB @ 0.2 Mbps  rtx: 131
    [38] 1.14 MB @ 0.3 Mbps  rtx: 120
    [39] 752.28 KB @ 0.2 Mbps  rtx: 91
    [40] 714.10 KB @ 0.2 Mbps  rtx: 102
    [41] 476.54 KB @ 0.1 Mbps  rtx: 110
    [42] 1013.88 KB @ 0.3 Mbps  rtx: 107
    [43] 1.06 MB @ 0.3 Mbps  rtx: 110
    [44] 866.82 KB @ 0.2 Mbps  rtx: 129
    [45] 933.28 KB @ 0.3 Mbps  rtx: 119
    [46] 1.23 MB @ 0.3 Mbps  rtx: 131
    [47] 839.95 KB @ 0.2 Mbps  rtx: 70
    [48] 825.81 KB @ 0.2 Mbps  rtx: 121
    [49] 0 B @ 0.0 Mbps  rtx: 7
    [50] 0 B @ 0.0 Mbps  rtx: 7
    [51] 0 B @ 0.0 Mbps  rtx: 8
    [52] 803.19 KB @ 0.2 Mbps  rtx: 107
    [53] 759.35 KB @ 0.2 Mbps  rtx: 103
    [54] 480.78 KB @ 0.1 Mbps  rtx: 90
    [55] 222.01 KB @ 0.1 Mbps  rtx: 79
    [56] 513.30 KB @ 0.1 Mbps  rtx: 116
    [57] 842.78 KB @ 0.2 Mbps  rtx: 109
    [58] 978.53 KB @ 0.3 Mbps  rtx: 121
    [59] 841.37 KB @ 0.2 Mbps  rtx: 106
    [60] 451.09 KB @ 0.1 Mbps  rtx: 92
    [61] 910.66 KB @ 0.2 Mbps  rtx: 135
    [62] 1.54 MB @ 0.4 Mbps  rtx: 109
    [63] 0 B @ 0.0 Mbps  rtx: 7
    [64] 673.09 KB @ 0.2 Mbps  rtx: 104
    [65] 0 B @ 0.0 Mbps  rtx: 7
    [66] 1.15 MB @ 0.3 Mbps  rtx: 126
    [67] 856.92 KB @ 0.2 Mbps  rtx: 125
    [68] 975.70 KB @ 0.3 Mbps  rtx: 118
    [69] 914.90 KB @ 0.2 Mbps  rtx: 131
    [70] 1.06 MB @ 0.3 Mbps  rtx: 119
    [71] 772.08 KB @ 0.2 Mbps  rtx: 108
    [72] 714.10 KB @ 0.2 Mbps  rtx: 130
    [73] 831.47 KB @ 0.2 Mbps  rtx: 78
    [74] 1.01 MB @ 0.3 Mbps  rtx: 111
    [75] 1023.78 KB @ 0.3 Mbps  rtx: 119
    [76] 0 B @ 0.0 Mbps  rtx: 7
    [77] 0 B @ 0.0 Mbps  rtx: 7
    [78] 0 B @ 0.0 Mbps  rtx: 7
    [79] 0 B @ 0.0 Mbps  rtx: 7
    [80] 0 B @ 0.0 Mbps  rtx: 7
    [81] 0 B @ 0.0 Mbps  rtx: 7
    [82] 0 B @ 0.0 Mbps  rtx: 7
    [83] 0 B @ 0.0 Mbps  rtx: 7
    [84] 1.02 MB @ 0.3 Mbps  rtx: 127
    [85] 924.80 KB @ 0.3 Mbps  rtx: 122
    [86] 0 B @ 0.0 Mbps  rtx: 7
    [87] 0 B @ 0.0 Mbps  rtx: 7
    [88] 937.52 KB @ 0.3 Mbps  rtx: 96
    [89] 1.41 MB @ 0.4 Mbps  rtx: 113
    [90] 742.38 KB @ 0.2 Mbps  rtx: 101
    [91] 0 B @ 0.0 Mbps  rtx: 7
    [92] 0 B @ 0.0 Mbps  rtx: 7
    [93] 0 B @ 0.0 Mbps  rtx: 7
    [94] 514.72 KB @ 0.1 Mbps  rtx: 95
    [95] 0 B @ 0.0 Mbps  rtx: 7
    [96] 1.34 MB @ 0.4 Mbps  rtx: 117
    [97] 0 B @ 0.0 Mbps  rtx: 7
    [98] 0 B @ 0.0 Mbps  rtx: 7
    [99] 0 B @ 0.0 Mbps  rtx: 7
    [100] 1.20 MB @ 0.3 Mbps  rtx: 103
    [101] 0 B @ 0.0 Mbps  rtx: 0
    [102] 343.62 KB @ 0.1 Mbps  rtx: 75
    [103] 832.88 KB @ 0.2 Mbps  rtx: 105
    [104] 0 B @ 0.0 Mbps  rtx: 0
    [105] 0 B @ 0.0 Mbps  rtx: 0
    [106] 0 B @ 0.0 Mbps  rtx: 0
    [107] 0 B @ 0.0 Mbps  rtx: 0
    [108] 650.47 KB @ 0.2 Mbps  rtx: 77
    [109] 407.25 KB @ 0.1 Mbps  rtx: 88
    [110] 55.15 KB @ 0.0 Mbps  rtx: 34
    [111] 0 B @ 0.0 Mbps  rtx: 0
    [112] 0 B @ 0.0 Mbps  rtx: 0
    [113] 749.45 KB @ 0.2 Mbps  rtx: 53
    [114] 551.48 KB @ 0.1 Mbps  rtx: 89
    [115] 0 B @ 0.0 Mbps  rtx: 0
    [116] 0 B @ 0.0 Mbps  rtx: 0
    [117] 798.95 KB @ 0.2 Mbps  rtx: 103
    [118] 733.90 KB @ 0.2 Mbps  rtx: 88
    [119] 863.99 KB @ 0.2 Mbps  rtx: 104
    [120] 1.14 MB @ 0.3 Mbps  rtx: 113
    [121] 0 B @ 0.0 Mbps  rtx: 0
    [122] 872.48 KB @ 0.2 Mbps  rtx: 111
    [123] 0 B @ 0.0 Mbps  rtx: 0
    [124] 0 B @ 0.0 Mbps  rtx: 0
    [125] 1.13 MB @ 0.3 Mbps  rtx: 120
    [126] 240.39 KB @ 0.1 Mbps  rtx: 63
    [127] 781.98 KB @ 0.2 Mbps  rtx: 99

────────────────────────────────────────────────────────────
```

Note that these issues might be due to might environment and kernel: quite a lot of retransmissions are seen.

The connection is closed after a few retransmissions. e.g. see this packets trace, I extracted only the ones from a connection that failed early: [trace-many-strip.zip](https://github.com/user-attachments/files/25777177/trace-many-strip.zip)

Or in text form:

```
No.     Time           dTime          Stream     Source                Destination           Protocol inflight   Length Info
     31 0.061649                      22         10.0.10.2             10.0.0.1              TCP                 80     48098 → 5201 [SYN] Seq=0 Win=64240 Len=0 MSS=1460 SACK_PERM TSval=4042796972 TSecr=0 WS=1024
    220 0.082162       0.020513       22         10.0.0.1              10.0.10.2             TCP                 80     5201 → 48098 [SYN, ACK] Seq=0 Ack=1 Win=65160 Len=0 MSS=1460 SACK_PERM TSval=3653060284 TSecr=4042796972 WS=1024
    221 0.082174       0.000012       22         10.0.10.2             10.0.0.1              TCP                 72     48098 → 5201 [ACK] Seq=1 Ack=1 Win=64512 Len=0 TSval=4042796993 TSecr=3653060284
    632 0.099785       0.017611       22         10.0.10.2             10.0.0.1              TCP                 88         160    48098 → 5201 [PSH, ACK] Seq=1 Ack=1 Win=64512 Len=88 TSval=4042797011 TSecr=3653060284 (SendTTL=112, Round=101)
    668 0.100035       0.000250       22         10.0.10.2             10.0.0.1              TCP      2984       2968   48098 → 5201 [PSH, ACK] Seq=89 Ack=1 Win=64512 Len=2896 TSval=4042797011 TSecr=3653060284
    672 0.100040       0.000005       22         10.0.10.2             10.0.0.1              TCP      5880       2968   48098 → 5201 [PSH, ACK] Seq=2985 Ack=1 Win=64512 Len=2896 TSval=4042797011 TSecr=3653060284
    675 0.100045       0.000005       22         10.0.10.2             10.0.0.1              TCP      8776       2968   48098 → 5201 [PSH, ACK] Seq=5881 Ack=1 Win=64512 Len=2896 TSval=4042797011 TSecr=3653060284
    678 0.100056       0.000011       22         10.0.10.2             10.0.0.1              TCP      11672      2968   48098 → 5201 [PSH, ACK] Seq=8777 Ack=1 Win=64512 Len=2896 TSval=4042797011 TSecr=3653060284
    681 0.100065       0.000009       22         10.0.10.2             10.0.0.1              TCP      13120      1520   48098 → 5201 [ACK] Seq=11673 Ack=1 Win=64512 Len=1448 TSval=4042797011 TSecr=3653060284
   1126 0.144780       0.044715       22         10.0.10.2             10.0.0.1              TCP      14568      1520   48098 → 5201 [ACK] Seq=13121 Ack=1 Win=64512 Len=1448 TSval=4042797056 TSecr=3653060284
   1848 0.370773       0.225993       22         10.0.10.2             10.0.0.1              TCP                 14568      160    [TCP Retransmission] 48098 → 5201 [PSH, ACK] Seq=1 Ack=1 Win=64512 Len=88 TSval=4042797282 TSecr=3653060284 (SendTTL=112, Round=101)
   3062 0.818792       0.448019       22         10.0.10.2             10.0.0.1              TCP                 14568      160    [TCP Retransmission] 48098 → 5201 [PSH, ACK] Seq=1 Ack=1 Win=64512 Len=88 TSval=4042797730 TSecr=3653060284 (SendTTL=112, Round=101)
   5617 1.738769       0.919977       22         10.0.10.2             10.0.0.1              TCP                 14568      160    [TCP Retransmission] 48098 → 5201 [PSH, ACK] Seq=1 Ack=1 Win=64512 Len=88 TSval=4042798650 TSecr=3653060284 (SendTTL=112, Round=101)
  10645 3.530784       1.792015       22         10.0.10.2             10.0.0.1              TCP                 14568      160    [TCP Retransmission] 48098 → 5201 [PSH, ACK] Seq=1 Ack=1 Win=64512 Len=88 TSval=4042800442 TSecr=3653060284 (SendTTL=112, Round=101)
  14870 5.132920       1.602136       22         10.0.0.1              10.0.10.2             TCP                 72     5201 → 48098 [FIN, ACK] Seq=1 Ack=1 Win=65536 Len=0 TSval=3653065335 TSecr=4042796993
  14875 5.133766       0.000846       22         10.0.10.2             10.0.0.1              TCP                 72     48098 → 5201 [ACK] Seq=14569 Ack=2 Win=64512 Len=0 TSval=4042802045 TSecr=3653065335
  15779 5.436816       0.303050       22         10.0.0.1              10.0.10.2             TCP                 72     [TCP Retransmission] 5201 → 48098 [FIN, ACK] Seq=1 Ack=1 Win=65536 Len=0 TSval=3653065639 TSecr=4042796993
  15780 5.436821       0.000005       22         10.0.10.2             10.0.0.1              TCP                 84     [TCP Dup ACK 14875#1] 48098 → 5201 [ACK] Seq=14569 Ack=2 Win=64512 Len=0 TSval=4042802348 TSecr=3653065639 SLE=1 SRE=2
  20545 7.114773       1.677952       22         10.0.10.2             10.0.0.1              TCP                 14568      160    [TCP Retransmission] 48098 → 5201 [PSH, ACK] Seq=1 Ack=2 Win=64512 Len=88 TSval=4042804026 TSecr=3653065639 (SendTTL=112, Round=101)
  20812 7.198801       0.084028       22         10.0.0.1              10.0.10.2             TCP                 60     5201 → 48098 [RST] Seq=2 Win=0 Len=0
```

Maybe due to `SO_KEEPALIVE` or a timeout per stream? Maybe it can be a bit too aggressive? (By default, I should be able to have more retransmissions with `net.ipv4.tcp_retries2 = 15`.)
